{
  "$schema": "../../.ai/schemas/handoff.schema.json",
  "schemaVersion": "1.0.0",
  "taskId": "AI-REPO-SYSTEM",
  "baseCommit": "e0ca9b3161a030733c5c9cc16435669265eda9d0",
  "currentCommit": "e0ca9b3161a030733c5c9cc16435669265eda9d0",
  "branch": "main",
  "dirty": true,
  "status": "complete",
  "scope": {
    "inScope": [
      "Audit current context sources",
      "Create .ai/ directory (START_HERE.md, authority-map.json, project.manifest.json, context-profiles.json, schemas/)",
      "Rewrite root AGENTS.md as concise front door",
      "Move engineering philosophy to docs/product/engineering-principles.md",
      "Add hierarchical AGENTS.md for src/engine, src/components/editor, src/app/api",
      "Create tool shims: CLAUDE.md, GEMINI.md, .github/copilot-instructions.md",
      "Create scripts/ai-context/ with doctor.ts, check.ts, build.ts",
      "Add ai:doctor, ai:check, ai:build scripts to package.json",
      "Create handoffs/AI-REPO-SYSTEM/ bundle",
      "Clean .gitignore"
    ],
    "outOfScope": [
      "Optional MCP server (directive section 14)",
      "Full architecture graph with thousands of nodes",
      "Clean-clone onboarding test harness (directive section 13)",
      "Generated context summaries under .ai/generated/",
      "Separate capabilities.json, actions.json, routes.json, ui-surfaces.json, tests.json, maturity.json, known-failures.json inventories",
      "Migrating root PNGs out of the repository",
      "Deleting recovery-manifest.json"
    ]
  },
  "completed": [
    "Audit current context sources (AGENTS.md, README.md, worklog.md, roadmap-state.json, recovery-manifest.json, agent-ctx/, .prime/agent/, docs/, engine-architecture/, corpus-extension/)",
    "Get actual git SHA (e0ca9b3161a030733c5c9cc16435669265eda9d0) and verify dirty state (tsconfig.tsbuildinfo tracked but gitignored)",
    "Verify package.json scripts: dev, build, lint, typecheck exist; test does not exist; lint passes; typecheck fails with exit 2",
    "Create .ai/START_HERE.md",
    "Create .ai/authority-map.json with 7-level precedence",
    "Create .ai/project.manifest.json with actual SHA, scripts, honest unknowns",
    "Create .ai/context-profiles.json with core/ui/engine/authorial/physics/terrain profiles",
    "Create .ai/schemas/*.schema.json (project-manifest, authority-map, context-profiles, handoff, handoff-evidence)",
    "Rewrite root AGENTS.md as concise ~2 page front door",
    "Preserve extended essays in docs/product/engineering-principles.md",
    "Add src/engine/AGENTS.md",
    "Add src/components/editor/AGENTS.md",
    "Add src/app/api/AGENTS.md",
    "Create CLAUDE.md, GEMINI.md, .github/copilot-instructions.md shims (byte-identical bodies)",
    "Create scripts/ai-context/lib.ts (shared utilities)",
    "Create scripts/ai-context/doctor.ts",
    "Create scripts/ai-context/check.ts",
    "Create scripts/ai-context/build.ts",
    "Add ai:doctor, ai:check, ai:build scripts to package.json",
    "Update README.md Quick Start to reference ai:doctor and ai:check",
    "Clean .gitignore (consolidated, removed duplicates, added .ai/generated/ and handoffs/*/artifacts/)",
    "Run ai:build to refresh manifest provenance and command exit codes",
    "Run ai:doctor — prints useful report (verified)",
    "Run ai:check — passes 19/19 checks (verified)",
    "Fix lint errors (require() imports → ES module imports)",
    "Fix shim drift (removed per-shim name references in body)",
    "Fix terminal escape interpretation ([medium] → medium  in doctor output)"
  ],
  "active": null,
  "blockedBy": [],
  "modifiedFiles": [
    "AGENTS.md",
    "README.md",
    ".gitignore",
    "package.json",
    ".ai/START_HERE.md",
    ".ai/authority-map.json",
    ".ai/project.manifest.json",
    ".ai/context-profiles.json",
    ".ai/schemas/project-manifest.schema.json",
    ".ai/schemas/authority-map.schema.json",
    ".ai/schemas/context-profiles.schema.json",
    ".ai/schemas/handoff.schema.json",
    ".ai/schemas/handoff-evidence.schema.json",
    "docs/product/engineering-principles.md",
    "src/engine/AGENTS.md",
    "src/components/editor/AGENTS.md",
    "src/app/api/AGENTS.md",
    "CLAUDE.md",
    "GEMINI.md",
    ".github/copilot-instructions.md",
    "scripts/ai-context/lib.ts",
    "scripts/ai-context/doctor.ts",
    "scripts/ai-context/check.ts",
    "scripts/ai-context/build.ts",
    "handoffs/AI-REPO-SYSTEM/TASK.md",
    "handoffs/AI-REPO-SYSTEM/STATE.json",
    "handoffs/AI-REPO-SYSTEM/EVIDENCE.json",
    "handoffs/AI-REPO-SYSTEM/CHANGES.md",
    "handoffs/AI-REPO-SYSTEM/NEXT.md"
  ],
  "requiredNextAction": "Commit the changes (git add + git commit). Then update worklog.md with the iteration record. The next follow-up tasks are listed in handoffs/AI-REPO-SYSTEM/NEXT.md.",
  "environment": {
    "runtime": "bun",
    "branch": "main",
    "worktree": "main worktree (no separate worktree — this is a documentation/tooling task, not engine code)"
  },
  "uncommittedState": "All AI-repo-system files are new or modified relative to base commit e0ca9b3. None committed yet. The tsconfig.tsbuildinfo file is dirty from a prior tsc run; it is gitignored but tracked — a known pre-existing drift that ai:check flags as low-severity."
}
